You two are the most fucked up people I've ever met and I deal with fucked up people for a living.,Tanner Bolt
[to Amy] You. Fucking. Bitch.,Nick Dunne
"[Opening lines] When I think of my wife, I always think of the back of her head. I picture cracking her lovely skull, unspooling her brain, trying to get answers. The primal questions of a marriage: What are you thinking? How are you feeling? What have we done to each other?",Nick Dunne
[Last lines]What are you thinking? How are you feeling? What have we done to each other? What will we do?,Nick Dunne
Everyone knows that 'complicated' is a code word for bitch.,Margo Dunne
I'm so much happier now that I'm dead. Technically missing. Soon to be presumed dead. Gone. And my lazy lying shitting oblivious husband will go to prison for my murder. Nick Dunne took my pride and my dignity and my hope and my money. He took and took from me until I no longer existed. That's murder. Let the punishment fit the crime.,Amy Dunne
Amazing fucking Amy is getting fucking married!,Amy Dunne
"When two people love each other and they can't make that work, that's the real tragedy.",Amy Dunne
"Want to test your marriage for weak spots? Add one recession, subtract two jobs. It's surprisingly effective.",Amy Dunne
